-- CREATE INDEX basic tests

CREATE TABLE idx_test (id INT, val TEXT);
CREATE TABLE
INSERT INTO idx_test VALUES (3, 'three');
INSERT 0 1
INSERT INTO idx_test VALUES (1, 'one');
INSERT 0 1
INSERT INTO idx_test VALUES (2, 'two');
INSERT 0 1
INSERT INTO idx_test VALUES (5, 'five');
INSERT 0 1
INSERT INTO idx_test VALUES (4, 'four');
INSERT 0 1
-- Create index on existing data
CREATE INDEX idx_test_id ON idx_test (id);
CREATE INDEX
-- Verify data is still accessible after index creation
SELECT * FROM idx_test ORDER BY id;
 id | val  
----+-------
  1 | one  
  2 | two  
  3 | three
  4 | four 
  5 | five 
(5 rows)
-- Insert more data (should maintain index)
INSERT INTO idx_test VALUES (6, 'six');
INSERT 0 1
INSERT INTO idx_test VALUES (0, 'zero');
INSERT 0 1
SELECT * FROM idx_test ORDER BY id;
 id | val  
----+-------
  0 | zero 
  1 | one  
  2 | two  
  3 | three
  4 | four 
  5 | five 
  6 | six  
(7 rows)
-- Update a row (should maintain index)
UPDATE idx_test SET val = 'ONE' WHERE id = 1;
UPDATE 1
SELECT * FROM idx_test ORDER BY id;
 id | val  
----+-------
  0 | zero 
  1 | ONE  
  2 | two  
  3 | three
  4 | four 
  5 | five 
  6 | six  
(7 rows)
-- Delete a row
DELETE FROM idx_test WHERE id = 3;
DELETE 1
SELECT * FROM idx_test ORDER BY id;
 id | val 
----+------
  0 | zero
  1 | ONE 
  2 | two 
  4 | four
  5 | five
  6 | six 
(6 rows)
-- Create index on text column
CREATE INDEX idx_test_val ON idx_test (val);
CREATE INDEX
SELECT * FROM idx_test ORDER BY val;
 id | val 
----+------
  1 | ONE 
  5 | five
  4 | four
  6 | six 
  2 | two 
  0 | zero
(6 rows)
-- Drop table (should clean up indexes)
DROP TABLE idx_test;
DROP TABLE
